{
  "eventId": "EVT-00000751-SEMAPHORE_ACQUIRED",
  "eventType": "SEMAPHORE_ACQUIRED",
  "mission": "MISSION-010",
  "payload": {
    "executionRole": "DEFECT_HUNTER",
    "kind": "WRITE",
    "semaphoreId": "SEM-QWEN-P11-001-3043F25B",
    "workerIdentity": "ELASTIC-QWEN-7DD60C4D"
  },
  "recordedAt": "2026-08-20T16:02:31Z",
  "runtimeGeneration": 751,
  "schemaVersion": 1,
  "workExecutionId": "WRK-20260820T160151Z-8cc98472",
  "workOrderId": "WO-P11-001-CONTINUOUS-QWEN-5A7067CA"
}
