{
  "eventId": "EVT-00001489-SEMAPHORE_ACQUIRED",
  "eventType": "SEMAPHORE_ACQUIRED",
  "mission": "MISSION-010",
  "payload": {
    "executionRole": "DEFECT_HUNTER",
    "kind": "WRITE",
    "semaphoreId": "SEM-QWEN-P11-001-6586EEE3",
    "workerIdentity": "ELASTIC-QWEN-6C08FBE2"
  },
  "recordedAt": "2026-08-30T11:20:40Z",
  "runtimeGeneration": 1489,
  "schemaVersion": 1,
  "workExecutionId": "WRK-20260830T111939Z-7ca42556",
  "workOrderId": "WO-P11-001-CONTINUOUS-QWEN-E9F39E50"
}
