{
  "eventId": "EVT-00000952-SEMAPHORE_RELEASED",
  "eventType": "SEMAPHORE_RELEASED",
  "mission": "MISSION-010",
  "payload": {
    "nextStatus": "READY",
    "semaphoreId": "SEM-QWEN-P11-001-162A0D01"
  },
  "recordedAt": "2026-08-27T03:36:57Z",
  "runtimeGeneration": 952,
  "schemaVersion": 1,
  "workExecutionId": "WRK-20260827T031657Z-e755bc9c",
  "workOrderId": "WO-P11-001-CONTINUOUS-QWEN-E9F39E50"
}
