{
  "eventId": "EVT-00001962-SEMAPHORE_ACQUIRED",
  "eventType": "SEMAPHORE_ACQUIRED",
  "mission": "MISSION-010",
  "payload": {
    "executionRole": "DEFECT_HUNTER",
    "kind": "WRITE",
    "semaphoreId": "SEM-QWEN-P11-001-DB50E9F6",
    "workerIdentity": "ELASTIC-QWEN-CA2FF5E8"
  },
  "recordedAt": "2026-09-02T08:40:01Z",
  "runtimeGeneration": 1962,
  "schemaVersion": 1,
  "workExecutionId": "WRK-20260902T083845Z-3ae375a5",
  "workOrderId": "WO-P11-001-CONTINUOUS-QWEN-5A7067CA"
}
