{
  "eventId": "EVT-00001574-SEMAPHORE_ACQUIRED",
  "eventType": "SEMAPHORE_ACQUIRED",
  "mission": "MISSION-010",
  "payload": {
    "executionRole": "DEFECT_HUNTER",
    "kind": "WRITE",
    "semaphoreId": "SEM-QWEN-P11-001-BDF6842D",
    "workerIdentity": "ELASTIC-QWEN-DD910A4E"
  },
  "recordedAt": "2026-08-30T23:31:38Z",
  "runtimeGeneration": 1574,
  "schemaVersion": 1,
  "workExecutionId": "WRK-20260830T233033Z-e2ef9d88",
  "workOrderId": "WO-P11-001-CONTINUOUS-QWEN-5A7067CA"
}
