{
  "eventId": "EVT-00000718-SEMAPHORE_RELEASED",
  "eventType": "SEMAPHORE_RELEASED",
  "mission": "MISSION-010",
  "payload": {
    "nextStatus": "READY",
    "semaphoreId": "SEM-QWEN-P11-001-700C0181"
  },
  "recordedAt": "2026-08-20T15:41:48Z",
  "runtimeGeneration": 718,
  "schemaVersion": 1,
  "workExecutionId": "WRK-20260820T154038Z-36dd83e2",
  "workOrderId": "WO-P11-001-CONTINUOUS-QWEN-5A7067CA"
}
