{
  "eventId": "EVT-00000882-SEMAPHORE_ACQUIRED",
  "eventType": "SEMAPHORE_ACQUIRED",
  "mission": "MISSION-010",
  "payload": {
    "executionRole": "DEFECT_HUNTER",
    "kind": "WRITE",
    "semaphoreId": "SEM-QWEN-P11-001-A450AFF4",
    "workerIdentity": "ELASTIC-QWEN-24E16B0A"
  },
  "recordedAt": "2026-08-26T17:38:16Z",
  "runtimeGeneration": 882,
  "schemaVersion": 1,
  "workExecutionId": "WRK-20260826T173732Z-8d6e98f2",
  "workOrderId": "WO-P11-001-CONTINUOUS-QWEN-E9F39E50"
}
