{
  "eventId": "EVT-00002514-SEMAPHORE_RELEASED",
  "eventType": "SEMAPHORE_RELEASED",
  "mission": "MISSION-010",
  "payload": {
    "nextStatus": "READY",
    "semaphoreId": "SEM-QWEN-P11-001-2150AF5D"
  },
  "recordedAt": "2026-09-05T17:30:33Z",
  "runtimeGeneration": 2514,
  "schemaVersion": 1,
  "workExecutionId": "WRK-20260905T170325Z-3ea58dab",
  "workOrderId": "WO-P11-001-CONTINUOUS-QWEN-5A7067CA"
}
